{
  "$id": "ctos-greeter",
  "$schema": "http://json-schema.org/draft-07/schema#",
  "title": "ctOS Greeter Config",
  "type": "object",
  "properties": {
    "user": { "type": "string", "description": "The default user." },
    "monitor": {
      "type": "string",
      "description": "The primary monitor with login field."
    },

    "animations": {
      "$ref": "#/$defs/animationProfile",
      "Title": "Default Animation Profile"
    },
    "fontFamily": {
      "type": "string",
      "description": "The monospace font to use."
    },
    "fakeIdentity": {
      "title": "Fake Identity",
      "type": "object",
      "description": "Configure the 'identity card' shown after logging in.",
      "properties": {
        "id": { "type": "string" },
        "class": { "type": "string" },
        "fullName": { "type": "string" }
      }
    },
    "fakeStatus": {
      "title": "Fake Status",
      "type": "object",
      "description": "Configure the status component in the top right.",
      "properties": {
        "env": { "type": "string" },
        "node": { "type": "string" }
      }
    },
    "modes": {
      "title": "Mode Settings",
      "type": "object",
      "description": "Mode specific settings",
      "properties": {
        "greetd": {
          "title": "Greetd Mode Settings",
          "type": "object",
          "properties": {
            "animations": { "$ref": "#/$defs/animationProfile" },
            "exit": {
              "description": "Optional command run after the session is launched. Usually not needed: Quickshell exits after launch and kwin exits with it (--exit-with-session).",
              "type": "array",
              "items": { "type": "string" }
            },
            "launch": {
              "description": "Preselected session: the first session whose Exec contains this command (e.g. startplasma-wayland).",
              "type": "array",
              "items": { "type": "string" },
              "minItems": 1
            }
          }
        },
        "lockd": {
          "title": "Lockd Mode Settings",
          "type": "object",
          "properties": {
            "animations": { "$ref": "#/$defs/animationProfile" }
          }
        },
        "kiosk": {
          "title": "Kiosk Mode Settings",
          "type": "object",
          "properties": {
            "animations": { "$ref": "#/$defs/animationProfile" }
          }
        },
        "test": {
          "title": "Test Mode Settings",
          "type": "object",
          "properties": {
            "animations": { "$ref": "#/$defs/animationProfile" }
          }
        }
      }
    }
  },

  "$defs": {
    "animationProfile": {
      "type": "string",
      "enum": ["none", "reduced", "all"],
      "description": "UI animation profile: 'all' for full transitions, 'reduced' for no splash."
    }
  }
}
