{
  "$schema": "https://raw.githubusercontent.com/alexsesser/ctOS/main/schema/greeter.schema.json",
  "user": "your-username",
  "monitor": "DP-1",
  "fontFamily": "JetBrainsMono Nerd Font",
  "fakeIdentity": {
    "id": "XYZ-843",
    "class": "L5_PROV",
    "fullName": "Blume Admin"
  },
  "fakeStatus": {
    "env": "Workstation",
    "node": "109.389.013.301"
  },
  "modes": {
    "greetd": {
      "animations": "all",
      "launch": ["startplasma-wayland"]
    },
    "lockd": {
      "animations": "reduced"
    },
    "test": {
      "animations": "all"
    }
  }
}
